{
  "id": "pei-textured",
  "name": "Textured PEI (powder-coated spring steel)",
  "aliases": [
    "Textured powder-coated plate",
    "PEI powder-coated sheet",
    "Gold textured plate",
    "Textured ULTEM plate"
  ],
  "status": "researched",
  "summary": "The modern default build surface: PEI resin electrostatically powder-coated and cured onto stainless or spring steel, leaving a fine sandy micro-texture instead of a laminated film. The texture raises contact area while lowering peak bond strength, so it grips hot and self-releases cold across PLA, PETG, ABS and ASA with no adhesives — at the cost of a matte, slightly orange-peel print bottom.",
  "surface_makeup": "Polyetherimide (PEI) powder coating, electrostatically applied and thermoset onto a stainless or spring steel sheet (aluminium on budget plates); micro-texture is inherent to the powder coat, not embossed",
  "texture": "textured",
  "manufacturers": [
    "Bambu Lab",
    "Prusa Research",
    "Creality",
    "Wham Bam",
    "FYSETC",
    "BIQU",
    "Energetic",
    "HartSmart",
    "TwoTrees",
    "MetaFlex3D"
  ],
  "filament_compatibility": [
    {
      "filament_id": "pla",
      "rating": "recommended",
      "bed_temp_c": {
        "min": 55,
        "max": 65
      },
      "adhesion_aid": "none",
      "notes": "Excellent general result, though very aggressive textures can let thin or small PLA parts lift at the corners — add a brim for those."
    },
    {
      "filament_id": "pla-plus",
      "rating": "recommended",
      "bed_temp_c": {
        "min": 55,
        "max": 65
      },
      "adhesion_aid": "none",
      "notes": "As base PLA."
    },
    {
      "filament_id": "pla-silk",
      "rating": "recommended",
      "bed_temp_c": {
        "min": 55,
        "max": 65
      },
      "adhesion_aid": "none",
      "notes": "Adhesion is fine, but the texture kills the silk sheen on the bottom face — use a smooth sheet if the underside is visible."
    },
    {
      "filament_id": "pla-matte",
      "rating": "recommended",
      "bed_temp_c": {
        "min": 55,
        "max": 65
      },
      "adhesion_aid": "none",
      "notes": "Texture and matte pigment give a uniform finish across all faces."
    },
    {
      "filament_id": "pla-cf",
      "rating": "recommended",
      "bed_temp_c": {
        "min": 55,
        "max": 65
      },
      "adhesion_aid": "none",
      "notes": "CF-filled PLA adheres at least as well as plain PLA; the coating is not damaged by the filler."
    },
    {
      "filament_id": "pvb",
      "rating": "recommended",
      "bed_temp_c": {
        "min": 70,
        "max": 80
      },
      "adhesion_aid": "none",
      "notes": "Good adhesion and clean release; keep IPA off the part itself, since PVB dissolves in alcohol."
    },
    {
      "filament_id": "petg",
      "rating": "recommended",
      "bed_temp_c": {
        "min": 70,
        "max": 80
      },
      "adhesion_aid": "none",
      "notes": "One of the best PETG surfaces there is: the texture prevents the chemical fusing that ruins smooth PEI, and parts release cleanly when cool."
    },
    {
      "filament_id": "pctg",
      "rating": "recommended",
      "bed_temp_c": {
        "min": 70,
        "max": 80
      },
      "adhesion_aid": "none",
      "notes": "Behaves as PETG; no separator needed."
    },
    {
      "filament_id": "pet",
      "rating": "recommended",
      "bed_temp_c": {
        "min": 70,
        "max": 85
      },
      "adhesion_aid": "none",
      "notes": "As PETG, slightly higher bed helps large footprints."
    },
    {
      "filament_id": "petg-cf",
      "rating": "recommended",
      "bed_temp_c": {
        "min": 70,
        "max": 80
      },
      "adhesion_aid": "none",
      "notes": "Fibre-filled copolyesters release very cleanly from powder-coated PEI."
    },
    {
      "filament_id": "petg-gf",
      "rating": "recommended",
      "bed_temp_c": {
        "min": 70,
        "max": 80
      },
      "adhesion_aid": "none",
      "notes": "As PETG-CF."
    },
    {
      "filament_id": "petg-esd",
      "rating": "recommended",
      "bed_temp_c": {
        "min": 70,
        "max": 80
      },
      "adhesion_aid": "none",
      "notes": "As PETG."
    },
    {
      "filament_id": "abs",
      "rating": "recommended",
      "bed_temp_c": {
        "min": 100,
        "max": 110
      },
      "adhesion_aid": "none",
      "notes": "Textured PEI handles ABS well without aids; enclosure and draft control remain the limiting factors."
    },
    {
      "filament_id": "abs-gf",
      "rating": "recommended",
      "bed_temp_c": {
        "min": 100,
        "max": 110
      },
      "adhesion_aid": "none",
      "notes": "Glass fill lowers warp; plate behaviour unchanged."
    },
    {
      "filament_id": "abs-fr",
      "rating": "recommended",
      "bed_temp_c": {
        "min": 100,
        "max": 110
      },
      "adhesion_aid": "none",
      "notes": "As ABS."
    },
    {
      "filament_id": "asa",
      "rating": "recommended",
      "bed_temp_c": {
        "min": 100,
        "max": 110
      },
      "adhesion_aid": "none",
      "notes": "Good grip and clean cold release; a brim helps on tall parts with small footprints."
    },
    {
      "filament_id": "asa-cf",
      "rating": "recommended",
      "bed_temp_c": {
        "min": 100,
        "max": 110
      },
      "adhesion_aid": "none",
      "notes": "As ASA."
    },
    {
      "filament_id": "hips",
      "rating": "recommended",
      "bed_temp_c": {
        "min": 100,
        "max": 110
      },
      "adhesion_aid": "none",
      "notes": "Prints and releases like ABS; common breakaway support material alongside it."
    },
    {
      "filament_id": "tpu",
      "rating": "usable-with-prep",
      "bed_temp_c": {
        "min": 40,
        "max": 60
      },
      "adhesion_aid": "glue stick if release is inconsistent",
      "notes": "The reduced contact area cuts the fusing risk versus smooth PEI, but soft TPU can still grab the texture and leave residue in it."
    },
    {
      "filament_id": "tpu-95a",
      "rating": "usable-with-prep",
      "bed_temp_c": {
        "min": 40,
        "max": 60
      },
      "adhesion_aid": "none to glue stick",
      "notes": "Hardest common grade; usually releases without help once fully cool."
    },
    {
      "filament_id": "tpu-90a",
      "rating": "usable-with-prep",
      "bed_temp_c": {
        "min": 40,
        "max": 60
      },
      "adhesion_aid": "glue stick if release is inconsistent",
      "notes": "Intermediate behaviour."
    },
    {
      "filament_id": "tpu-85a",
      "rating": "usable-with-prep",
      "bed_temp_c": {
        "min": 40,
        "max": 60
      },
      "adhesion_aid": "glue stick recommended",
      "notes": "Soft grades work into the texture and can tear at removal."
    },
    {
      "filament_id": "tpu-60a",
      "rating": "usable-with-prep",
      "bed_temp_c": {
        "min": 30,
        "max": 50
      },
      "adhesion_aid": "glue stick required",
      "notes": "Very soft grade; without a separator it can leave elastomer embedded in the powder coat."
    },
    {
      "filament_id": "tpe",
      "rating": "usable-with-prep",
      "bed_temp_c": {
        "min": 30,
        "max": 50
      },
      "adhesion_aid": "glue stick required",
      "notes": "As low-Shore TPU; separator both aids release and protects the coating."
    },
    {
      "filament_id": "cope",
      "rating": "usable-with-prep",
      "bed_temp_c": {
        "min": 45,
        "max": 70
      },
      "adhesion_aid": "glue stick if release is inconsistent",
      "notes": "Copolyester elastomer; grips harder than TPU of similar hardness."
    },
    {
      "filament_id": "pa",
      "rating": "avoid",
      "bed_temp_c": {
        "min": 70,
        "max": 100
      },
      "adhesion_aid": "glue stick required if attempted",
      "notes": "Adhesion is unpredictable and moisture-dependent; community consensus still favours G10/garolite for nylon over textured PEI."
    },
    {
      "filament_id": "pa6",
      "rating": "avoid",
      "bed_temp_c": {
        "min": 70,
        "max": 100
      },
      "adhesion_aid": "glue stick required if attempted",
      "notes": "As base PA."
    },
    {
      "filament_id": "pa12",
      "rating": "avoid",
      "bed_temp_c": {
        "min": 70,
        "max": 100
      },
      "adhesion_aid": "glue stick required if attempted",
      "notes": "Lower moisture sensitivity but the same adhesion mismatch."
    },
    {
      "filament_id": "pa66",
      "rating": "avoid",
      "bed_temp_c": {
        "min": 80,
        "max": 110
      },
      "adhesion_aid": "glue stick required if attempted",
      "notes": "High shrinkage compounds the weak bond."
    },
    {
      "filament_id": "pa6-cf",
      "rating": "avoid",
      "bed_temp_c": {
        "min": 70,
        "max": 100
      },
      "adhesion_aid": "glue stick required if attempted",
      "notes": "CF fill reduces warp, but garolite remains the recommended surface."
    },
    {
      "filament_id": "pa12-cf",
      "rating": "avoid",
      "bed_temp_c": {
        "min": 70,
        "max": 100
      },
      "adhesion_aid": "glue stick required if attempted",
      "notes": "As PA6-CF."
    },
    {
      "filament_id": "ppa",
      "rating": "avoid",
      "bed_temp_c": {
        "min": 90,
        "max": 120
      },
      "adhesion_aid": "dedicated high-temp surface required",
      "notes": "Bed temps and adhesion behaviour sit outside what powder-coated PEI is characterised for."
    },
    {
      "filament_id": "ppa-cf",
      "rating": "avoid",
      "bed_temp_c": {
        "min": 90,
        "max": 120
      },
      "adhesion_aid": "dedicated high-temp surface required",
      "notes": "As PPA."
    },
    {
      "filament_id": "pc",
      "rating": "usable-with-prep",
      "bed_temp_c": {
        "min": 110,